<?xml version="1.0" encoding="UTF-8" ?>
<rows xmlns:xsi="http://www.w3.org/2001/XMLSchema-instance"
 xsi:noNamespaceSchemaLocation="SEMESTERS.xsd">
  <ROW>
    <YEAR>2014</YEAR>
    <NAME>Some Semester</NAME>
    <CAMPUS>Main Campus</CAMPUS>
    <SESSION_KEY></SESSION_KEY>
    <CLASSES_START>1401580800</CLASSES_START>
    <GRADES_DUE>1409529600</GRADES_DUE>
  </ROW>
</rows>
